{
  "metadata": {
    "schema_version": "0.1.0",
    "artifact_id": "APR-OTF-G1-002",
    "artifact_type": "ApprovalRecord",
    "artifact_version": "0.1.0",
    "project_id": "PROJ-OTF-001",
    "title": "养老目标基金购买者研究 Gate 1 分群补充确认记录",
    "language": "zh-CN",
    "lifecycle_status": "FROZEN",
    "created_at": "2026-07-23T19:10:00+08:00",
    "updated_at": "2026-07-23T19:10:00+08:00",
    "created_by": {
      "actor_id": "AGENT-CTRL-01",
      "actor_type": "AGENT",
      "role": "研究总控",
      "model_id": "codex",
      "capability_version": "0.2.0"
    },
    "upstream_refs": [
      {
        "artifact_id": "RB-OTF-001",
        "artifact_type": "ResearchBrief",
        "artifact_version": "0.2.0"
      }
    ],
    "content_classification": "REAL",
    "sensitivity_level": "INTERNAL",
    "contains_personal_data": false,
    "change_summary": "记录项目发起人确认年龄作为 Demo 唯一基础分群，并授权按该口径完善有效性规则和修订问卷。"
  },
  "gate_id": "GATE_1",
  "status": "APPROVED",
  "primary_target_ref": {
    "artifact_id": "RB-OTF-001",
    "artifact_type": "ResearchBrief",
    "artifact_version": "0.2.0"
  },
  "reviewed_refs": [
    {
      "artifact_id": "RB-OTF-001",
      "artifact_type": "ResearchBrief",
      "artifact_version": "0.2.0"
    }
  ],
  "reviewer": {
    "actor_id": "HUMAN-PROJECT-SPONSOR",
    "actor_type": "HUMAN",
    "role": "客户研究项目发起人"
  },
  "reviewer_role": "客户研究项目发起人",
  "authority_basis": "项目发起人在连续任务中确认先完善题型体系和 Gate 1 分群分析预案，以年龄作为当前 Demo 的基础分群，并在本轮要求复核后细化有效性流程及修改问卷。",
  "recorded_at": "2026-07-23T19:10:00+08:00",
  "decided_at": "2026-07-23T19:10:00+08:00",
  "decision_basis": "研究对象和六个研究问题保持不变；新增内容只包括一个年龄段分群、三类预设比较、五点评分测量方向和最小分析边界，没有扩张到收入、职业、资产、招募或适当性判断。",
  "blocking_issues": [],
  "required_changes": [],
  "accepted_risks": [
    "年龄子组由实际回收决定，过小子组只合并或不展示，不把方向性差异外推为总体差异。",
    "本案例不进行概率抽样和显著性检验，研究结论只描述本次有效答卷。",
    "参与者可以选择不愿回答年龄，该回答仍保留为有效研究信息，但不进入具体年龄组比较。"
  ],
  "attestations": {
    "reviewed_primary_target": true,
    "reviewed_supporting_artifacts": true,
    "reviewed_material_changes": true,
    "authorized_to_decide": true
  },
  "comments": "允许基于 ResearchBrief 0.2.0 生成新的 ResearchPlan 与 InstrumentSpec；本批准不代表问卷正文或数据处理结果已通过 Gate 2 或 Gate 3。",
  "supersedes_approval_id": "APR-OTF-G1-001",
  "invalidation_rule": "ANY_REVIEWED_ARTIFACT_VERSION_CHANGE_REQUIRES_NEW_APPROVAL",
  "is_ai_approval": false
}
